{
  "schema_version": "0.1.0",
  "source_snapshot_id": "source_fixture",
  "source_ref": "source_fixture",
  "kind": "synthetic",
  "captured_at": "2026-08-21T20:55:00Z",
  "fingerprint": {"method": "synthetic_seed", "value": "seed:20260821", "strength": "strong"},
  "engine": {"name": "duckdb", "version": "1.4.0"},
  "schema_digest": "sha256:2222222222222222222222222222222222222222222222222222222222222222",
  "extensions": {}
}
